{
  "id": "kb-008",
  "title": "What the Eco-Scorer can and cannot see",
  "category": "visual-assessment",
  "summary": "The optional Eco-Scorer runs a local COCO object detector and returns object labels, bounding boxes, and model confidence. It cannot assess sustainability performance from appearance and does not calculate an environmental score.",
  "content": "Upload a JPEG, PNG, or WebP photo (maximum 10 MB) when the local model is enabled. The image is processed in memory by the configured EcoPath.AI backend and is not retained. Detection metadata and reviewed labels are saved.\n\nConfirm, correct, or dismiss each detection. Confirmed mapped objects can retrieve related articles from the curated knowledge base and can be saved to the Action Planner. Object presence is not evidence of environmental benefit or harm, so the application withholds a numeric environmental score.\n\nA photo cannot reliably establish lifecycle emissions, actual electricity use, product composition, or recyclability in every location. Never upload ID documents, electricity bills with account numbers, or photos of people who have not agreed.",
  "audience": ["individual", "household", "business"],
  "applicability_conditions": ["Has a photo of a supported indoor scene"],
  "implementation_steps": [
    "Photograph the scene in good light",
    "Review detections and confirm only what you agree is present",
    "Save confirmed, article-backed guidance to the Action Planner if useful"
  ],
  "limitations": [
    "The model detects COCO object classes only, not materials, product composition, energy efficiency, BEE labels, or recyclability",
    "A photo cannot establish lifecycle emissions or actual electricity use",
    "Detector confidence is not a calibrated probability or sustainability-confidence measure",
    "No generative AI vision API is used"
  ],
  "source_title": "EcoPath.AI Eco-Scorer methodology",
  "source_publisher": "EcoPath.AI",
  "source_url": "",
  "publication_date": "2026-10-16",
  "last_verified_date": "2026-10-16",
  "verification_status": "unverified",
  "related_recommendation_ids": [],
  "tags": ["eco-scorer", "privacy", "computer-vision"]
}
