{
  "id": "kb-003",
  "title": "Reducing household food waste (India)",
  "category": "food-kitchen",
  "summary": "Wasted food wastes money. EcoPath.AI estimates rupee impact only from the grocery spend and waste fraction you enter. It does not assume a national waste percentage for your kitchen.",
  "content": "Indian households vary widely: joint families, tiffin/dabbawala meals, and frequent fresh vegetable purchases change waste patterns. Do not use a European 25% benchmark as if it were your kitchen.\n\nPractical steps that do not depend on an invented statistic:\n- Check the fridge and wet-waste bin before bazaar or online grocery orders.\n- Store cooked food covered; reheat once; freeze portions if you have a freezer.\n- Understand packed-food date marks on the pack you actually bought.\n-   Wet waste should be kept separate from dry waste where your local body asks for segregation. Confirm GHMC or your municipality's current circular — EcoPath.AI does not invent pickup days or colony-wise rules.\n\nIf you track wasted food in rupees or kilograms for a week, enter that as a measured or estimated resource record.",
  "audience": ["individual", "household"],
  "applicability_conditions": ["Purchases food"],
  "implementation_steps": [
    "Weigh or estimate wet food waste for seven days if you want a baseline",
    "Plan meals around perishable vegetables you already have",
    "Enter monthly grocery spend in ₹ as a resource record",
    "Segregate wet and dry waste according to your local body's published rules"
  ],
  "limitations": [
    "No rupee saving is claimed until you provide spend and a waste fraction",
    "Local composting or GHMC wet-waste collection points are not listed here because they change and were not verified per ward"
  ],
  "source_title": "Central Pollution Control Board",
  "source_publisher": "Central Pollution Control Board",
  "source_url": "https://cpcb.nic.in/",
  "publication_date": "",
  "last_verified_date": "2026-10-16",
  "verification_status": "unverified",
  "related_recommendation_ids": ["rec-003"],
  "tags": ["food", "wet-waste", "household", "INR"]
}
